{"artifact_schema_id":"scgp_global_cache_seal_v1","decision":"GO","gate_rule":"GO iff BOTH dataset cache banks verify: independent Merkle root match, call_count==4*unique_pack_count, all forbidden zero_counters==0, exactly R replicas per video, provenance hashes present, manifest payload intact","gold_isolation":{"only_gold_supervision":"parent_video_binary_label","train_labels_opened_by_seal":false},"hashes":{"config_sha256":"6d6b4faf364b0967befda1ef75f0cd9645294168289092e58d6e69912c6a8270","replica_schema_sha256":"4bfcfea2d4dd38fd8a8125fb803fbde0c5ec05fa12a96d13b908246a6f03f68d","seal_schema_sha256":"f4605bb7bd26f730c75e20636841f243f0bf10080b6ea12a70363d9a42790ce1"},"labels_enter_after_this_seal_only":true,"no_success_claim":true,"payload_sha256":"eb1d40d3dccf62f01e54169f02111152c35e3b99e87fec83e35964f82e348534","per_dataset":[{"cache_merkle_root":"ad98d8e869a00f1a47280080e0b9e78b8ff701036d67e3707cf82a7f50d6644d","call_count":2196,"dataset":"MHC","input_builder_hash":"7b2d0d0b4cb977a1a471053eedabdab005cae05576fc96898af266633e8d9b3d","model_processor_hash":"8276c578030472f7e193c7da9ce3e938f8f7dca68527498cd99eb4a8ff13e474","prompt_hash":"cefed4f27df54a31a93f7686715a3640a0abb927cadb2a68d2131f91866afc71","seal_checks":{"all_videos_have_R_replicas":true,"cache_jsonl_sha256":"c7e2bf8a46e249ea5e28fda884820fa1c67b8f4fcde3a599c22367b13d5a7d37","cache_manifest_sha256":"67bac42d9f8722df1e706482552ae6297704792b14404cae01f49806672e68b6","call_count_equals_4_unique":true,"manifest_payload_ok":true,"merkle_root_recomputed_match":true,"provenance_hashes_present":true,"recomputed_merkle_root":"ad98d8e869a00f1a47280080e0b9e78b8ff701036d67e3707cf82a7f50d6644d","record_count":2196,"unique_pack_count":549,"verified":true,"video_count":549,"zero_counters_all_zero":true},"train_id_allowlist_sha256":"a2b6c275f990c9fc24a79dba73dc3b671c2a940c1f2e6bb089061caa24d33bce","zero_counters":{"cache_outer_held_content_read_count":0,"cache_outer_held_label_read_count":0,"cache_test_content_read_count":0,"cache_test_label_read_count":0,"cache_validation_content_read_count":0,"cache_validation_label_read_count":0,"certificate_read_count":0,"compiler_target_read_count":0,"forbidden_path_read_count":0,"held_content_read_count":0,"held_label_read_count":0,"margin_read_count":0,"mllm_calls_outside_train_cache":0,"neighbor_read_count":0,"network_model_api_call_count":0,"non_allowlisted_train_content_read_count":0,"ocr_call_count":0,"prediction_read_count":0,"query_labels_read_count":0,"query_z_read_count":0,"seed_read_count":0,"segment_gold_read_count":0,"split_statistic_read_count":0,"teacher_artifact_read_count":0,"teacher_cache_read_count":0,"test_content_read_count":0,"test_label_read_count":0,"train_label_read_count":0,"validation_content_read_count":0,"validation_label_read_count":0}},{"cache_merkle_root":"563bcefb8217a92c4045e981c2267fa5a0d5a72b54d9da5c74ebb17c7190fa21","call_count":2316,"dataset":"MHC_zh","input_builder_hash":"7b2d0d0b4cb977a1a471053eedabdab005cae05576fc96898af266633e8d9b3d","model_processor_hash":"8276c578030472f7e193c7da9ce3e938f8f7dca68527498cd99eb4a8ff13e474","prompt_hash":"cefed4f27df54a31a93f7686715a3640a0abb927cadb2a68d2131f91866afc71","seal_checks":{"all_videos_have_R_replicas":true,"cache_jsonl_sha256":"df22ce4834435d31ff410910df4d3bef87ed8710cdfd36983fdf9995a7dcf791","cache_manifest_sha256":"e4a6fc5620df175992210922e45eb9a2b25bbde68beba5cb05350eb140930ed4","call_count_equals_4_unique":true,"manifest_payload_ok":true,"merkle_root_recomputed_match":true,"provenance_hashes_present":true,"recomputed_merkle_root":"563bcefb8217a92c4045e981c2267fa5a0d5a72b54d9da5c74ebb17c7190fa21","record_count":2316,"unique_pack_count":579,"verified":true,"video_count":579,"zero_counters_all_zero":true},"train_id_allowlist_sha256":"6dec06554467b40f6856b27f4ea8d9613237b46c285eee346e672d73f7eac25b","zero_counters":{"cache_outer_held_content_read_count":0,"cache_outer_held_label_read_count":0,"cache_test_content_read_count":0,"cache_test_label_read_count":0,"cache_validation_content_read_count":0,"cache_validation_label_read_count":0,"certificate_read_count":0,"compiler_target_read_count":0,"forbidden_path_read_count":0,"held_content_read_count":0,"held_label_read_count":0,"margin_read_count":0,"mllm_calls_outside_train_cache":0,"neighbor_read_count":0,"network_model_api_call_count":0,"non_allowlisted_train_content_read_count":0,"ocr_call_count":0,"prediction_read_count":0,"query_labels_read_count":0,"query_z_read_count":0,"seed_read_count":0,"segment_gold_read_count":0,"split_statistic_read_count":0,"teacher_artifact_read_count":0,"teacher_cache_read_count":0,"test_content_read_count":0,"test_label_read_count":0,"train_label_read_count":0,"validation_content_read_count":0,"validation_label_read_count":0}}],"run_id":"LBSCGP-GLOBAL-M1-CACHE-SEAL-v1","schema_version":"lb_scgp_global_r2_m1_cache_seal_manifest_v1","slurm_job_id":"13035","terminal_state":"CACHE_SEALED"}
